子事件,子事件时间,评论序号,用户ID,评论时间,评论内容,用户位置,评论点赞量
"九三阅兵震撼外国网友:中国最好的“武器”,是不把钱花在战争上",9月5日 20:12,0,,,非百家号页面，跳过评论爬取,,0
九三阅兵中的钢铁洪流实现了哪些升级?,9月5日 09:09,0,,,非百家号页面，跳过评论爬取,,0
大批国产新装备震撼亮相九三阅兵,9月4日 14:00,0,,,非百家号页面，跳过评论爬取,,0
"九三阅兵,新一代武器装备震撼亮相",9月4日 10:24,1,ykn999ykn999,09-04 16:04,军事高科技搏弈己进入白热化，此消彼长，我有你无，关系国运。中国应研制诱导返击技术，当敌国向我发射导弹或无人机，我方应破解敌方导弹和无人机数据，用Al技术为我所用，引导敌向我发射的导弹、无人机在半途中听我指令折返回射敌方高价值军事目标。,北京,2
"九三阅兵,新一代武器装备震撼亮相",9月4日 10:24,2,顾拉丝,09-05 08:40,新一代武器装备一出场，真是科幻感拉满，震撼到不行！,广东,2
"九三阅兵,新一代武器装备震撼亮相",9月4日 10:24,3,百度网友a48e762b,09-05 08:41,陆海空全线高能，看到歼-20S和舰载机方队那刻热血翻涌,河北,1
中国九三阅兵数种新型装备一一亮相，一个比一个还猛,9月3日 22:47,0,,,非百家号页面，跳过评论爬取,,0
九三阅兵震撼亮相，外媒的反应来了,9月3日 16:55,0,,,非百家号页面，跳过评论爬取,,0
强军有我!“湖北造”远箱火震撼亮相九三阅兵,9月3日 15:04,0,,,非百家号页面，跳过评论爬取,,0
