子事件,子事件时间,评论序号,用户ID,评论时间,评论内容,用户位置,评论点赞量
比亚迪欧洲市场表现亮眼,9月7日 10:07,0,,,非百家号页面，跳过评论爬取,,0
比亚迪在欧洲新能源市场成绩亮眼,9月5日 22:42,0,,,非百家号页面，跳过评论爬取,,0
比亚迪引领欧洲新能源市场,9月5日 21:11,1,街头美食密探,09-06 21:41,在老牌车企的大本营杀出重围，比亚迪靠的不是低价，而是技术与品质，这才是真正的出海标杆。,湖南,0
比亚迪引领欧洲新能源市场,9月5日 21:11,2,风雨同舟h98,09-06 19:58,比亚迪在欧洲杀疯了！上半年销量猛增，多车型霸榜，不愧是国货之光。,广东,0
从欧洲新能源市场汽车销量榜单，看中国汽车品牌崛起,9月5日 20:23,0,,,非百家号页面，跳过评论爬取,,0
"比亚迪完成重大突破,引领欧洲新能源汽车市场",9月5日 20:10,1,Weiwei的钢铁侠,09-05 20:19,简单却不失深意💡,山西,0
"比亚迪完成重大突破,引领欧洲新能源汽车市场",9月5日 20:10,2,我是冷静啊bp,09-08 07:46,真金不怕火炼,山东,1
比亚迪欧洲市场份额超越特斯拉,9月3日 00:00,0,,,非百家号页面，跳过评论爬取,,0
