子事件,子事件时间,评论序号,用户ID,评论时间,评论内容,用户位置,评论点赞量
洪秀柱出席九三阅兵,9月5日 11:54,0,,,非百家号页面，跳过评论爬取,,0
郑丽文评洪秀柱参加阅兵,9月4日 17:07,0,,,非百家号页面，跳过评论爬取,,0
洪秀柱现身阅兵现场，民进党破防？台前省长发声，强调两岸都是华夏儿女,9月4日 16:24,0,,,非百家号页面，跳过评论爬取,,0
洪秀柱现身阅兵赖清德崩盘了更要命的在后头大陆准备上手段,9月3日 19:23,0,,,非百家号页面，跳过评论爬取,,0
"洪秀柱顶风赴京出席阅兵,民进党威胁将查办,国民党撇清关系",9月3日 12:39,0,,,非百家号页面，跳过评论爬取,,0
"洪秀柱出席九三阅兵,笑称回台被批判无所谓",9月3日 08:01,0,,,非百家号页面，跳过评论爬取,,0
洪秀柱抵达北京，将出席九三阅兵,9月2日 16:01,0,,,非百家号页面，跳过评论爬取,,0
"洪秀柱将出席九三阅兵,背后释放三信号",9月2日 14:01,0,,,非百家号页面，跳过评论爬取,,0
中国国民党前主席洪秀柱女士率队参加大陆九三阅兵,9月2日 12:53,0,,,非百家号页面，跳过评论爬取,,0
