子事件,子事件时间,评论序号,用户ID,评论时间,评论内容,用户位置,评论点赞量
美网:阿尼西莫娃淘汰大坂直美 晋级女单决赛,9月5日 16:11,1,真诚私房菜安诺,09-05 23:21,中国球员啥时候能做到,安徽,0
美网:阿尼西莫娃淘汰大坂直美 晋级女单决赛,9月5日 16:11,2,自拍Heartbreaker,09-05 22:19,阿尼西莫娃打得真出色，晋级决赛太棒了。赛后拥抱温暖人心。,山东,1
大坂直美晋级女单四强,9月5日 10:34,0,,,非百家号页面，跳过评论爬取,,0
美网女单四强出炉,9月4日 13:16,1,玉儿Cpr,09-04 14:30,期待精彩半决赛,山东,0
美网女单四强出炉,9月4日 13:16,2,重庆Chow的Fans,09-04 13:20,这个视角很有趣哦👀,山西,1
美网女单下半区阿尼西莫娃击败斯瓦泰克 大阪直美则两盘力克穆霍娃,9月4日 10:21,1,杭州LeeSin,09-05 03:10,阿尼西莫娃挑落世界第一，大阪直美逆转太精彩了。两位选手太强了，半决赛值得期待。,广东,1
"无情擦网球报双蛋之仇 阿尼西莫娃6-4/6-3斯瓦泰克,在主场打进美网四强!",9月4日 06:11,0,,,非百家号页面，跳过评论爬取,,0
