子事件,子事件时间,评论序号,用户ID,评论时间,评论内容,用户位置,评论点赞量
美国就业数据疲软、推高美联储9月降息预期,9月8日 17:52,0,,,非百家号页面，跳过评论爬取,,0
美国就业爆冷:非农仅增2.2万!9月或降息50基点?,9月8日 00:10,0,,,非百家号页面，跳过评论爬取,,0
美就业数据恶化 分析预测美联储9月可能降息,9月7日 06:47,0,,,非百家号页面，跳过评论爬取,,0
美国非农就业大幅低于预期，9月降息50个基点概率大,9月6日 14:24,1,不灬忆t,09-11 10:34,500点,上海,0
美国非农就业大幅低于预期，9月降息50个基点概率大,9月6日 14:24,2,我命由我不由天Yr,09-07 14:17,就25点！,云南,0
美国就业报告惨淡加剧降息预期,9月6日 12:16,0,,,非百家号页面，跳过评论爬取,,0
"就业增长放缓使美联储降息成定局,白宫批评鲍威尔行动迟缓",9月5日 23:46,0,,,非百家号页面，跳过评论爬取,,0
美国就业市场频传走弱信号 美联储利率路径或更为曲折,9月5日 17:50,0,,,非百家号页面，跳过评论爬取,,0
