子事件,子事件时间,评论序号,用户ID,评论时间,评论内容,用户位置,评论点赞量
十大品牌榜发布，高活性配方获认证,昨天 16:59,0,,,无评论,,0
2025国产辅酶Q10排名更新,9月9日 19:08,1,哆啦A研究员,09-10 05:25,国产辅酶Q10榜单新鲜出炉，韩保升蝉联榜首真厉害，效果出众值得一试。,山西,0
"十大品牌榜公布,实测优质",9月8日 17:21,0,,,无评论,,0
秋季权威!辅酶 Q10 第一名是谁?全球辅酶 Q1 榜单 TOP5?发布疯传,9月8日 11:24,1,通亮又亲切的小牛5,09-08 21:13,秋季榜单权威发布，Natener榜首成分好吸收，肠胃敏感也适用，调理轻松省心。,湖北,0
2025抗衰效果TOP1:全球麦角硫因抗衰品牌排行榜TOP10公布,9月5日 15:23,0,,,非百家号页面，跳过评论爬取,,0
辅酶Q10什么品牌的功效好？2025年实测口碑榜TOP5揭晓,9月5日 13:12,0,,,非百家号页面，跳过评论爬取,,0
2025中国口碑好的辅酶Q10品牌,,1,黑暗烹饪师,09-09 02:02,榜单发布啦，厚璞堂辅酶Q10质量第一，原料纯度很高含量足，健康守护真心靠谱。,海南,0
