子事件,子事件时间,评论序号,用户ID,评论时间,评论内容,用户位置,评论点赞量
韩企遭突袭执法，美国营商环境再受质疑,9月9日 00:00,0,,,非百家号页面，跳过评论爬取,,0
超300名韩国公民在美被抓捕 韩媒:被捕公民最早将于10日乘包机返韩,9月8日 17:24,0,,,非百家号页面，跳过评论爬取,,0
"大批韩国人在美被拴上铁链带走,特朗普却说“不会影响美韩关系”?",9月8日 16:17,0,,,无评论,,0
美执法局突袭韩企，475人被捕，美韩关系受考验,9月8日 14:06,0,,,非百家号页面，跳过评论爬取,,0
美国大规模突击韩企工厂，475名工人被拘留，现代LG电池厂被迫停工,9月8日 12:46,0,,,无评论,,0
美国移民执法部门抓捕475人 大多来自韩国·韩总统办公室通报 已与美方就释放被捕韩企人员协商完毕,9月8日 07:58,0,,,非百家号页面，跳过评论爬取,,0
美突击搜查韩企，韩国震惊：“这难道不是遭到背弃吗？”,9月8日 07:28,0,,,无评论,,0
300多名韩国人在美被捕 韩国政府紧急商讨对策,9月7日 08:48,0,,,非百家号页面，跳过评论爬取,,0
美国佐治亚州:韩国现代汽车工厂遭移民突查 475人被拘捕,9月6日 12:44,0,,,非百家号页面，跳过评论爬取,,0
