子事件,子事件时间,评论序号,用户ID,评论时间,评论内容,用户位置,评论点赞量
广东男篮7分险胜，新援首秀40分,9月9日 18:44,0,,,非百家号页面，跳过评论爬取,,0
广东全运会16人出炉，崔永熙不打，3人离队，3小将加入,9月5日 19:26,0,,,非百家号页面，跳过评论爬取,,0
广东全运会豪华阵容终于合体,9月4日 17:46,0,,,非百家号页面，跳过评论爬取,,0
广东全运会阵容确定，辽宁签21+11新星，上海接触欧锦赛28分外援,9月3日 17:04,0,,,非百家号页面，跳过评论爬取,,0
广东男篮和四川男篮砸重金冲冠恐成泡影,9月3日 11:26,0,,,非百家号页面，跳过评论爬取,,0
广东全运阵容集齐6省7队精英,9月3日 08:28,0,,,非百家号页面，跳过评论爬取,,0
广东男篮全运会阵容:赵睿 胡明轩 徐杰 沈梓捷领衔!,9月2日 15:33,0,,,非百家号页面，跳过评论爬取,,0
"广东男篮注册球员更新:崔永熙预注册,任骏飞不在名单中",8月31日 21:00,0,,,非百家号页面，跳过评论爬取,,0
广东男篮更新注册名单，核心阵容清晰,8月31日 15:30,0,,,非百家号页面，跳过评论爬取,,0
