子事件,子事件时间,评论序号,用户ID,评论时间,评论内容,用户位置,评论点赞量
"“湘超”永州队赛程(第一阶段)定了!7主6客,首场主场将于9月21日开启",9月8日 16:36,0,,,非百家号页面，跳过评论爬取,,0
"2025“湘超”即将开幕,14市州足球“战火”重燃!",9月7日 12:47,0,,,非百家号页面，跳过评论爬取,,0
“湘超”永州队队名、口号、吉祥物、队服、队徽官宣,9月6日 11:49,1,小赵的混沌神王,09-06 18:50,永冲锋这名儿真带劲，队服蓝白显底蕴。赛场加油冲冲冲！,海南,0
"9月7日晚,刘建宏将做客“湘超”揭幕战官方直播",9月5日 17:18,1,EYTV90743,09-05 22:27,湘超揭幕战有刘建宏解说，这下精彩了。神秘嘉宾也亮相，一起准时蹲直播。,云南,0
“湘超”揭幕战一票难求，英超转会费支出超德西法意甲总和,9月4日 14:33,0,,,非百家号页面，跳过评论爬取,,0
“湘超”来了!9月7日举行开幕式 “韵味”不止于赛场,9月3日 08:17,0,,,非百家号页面，跳过评论爬取,,0
湘超联赛9月启幕,9月1日 20:51,0,,,非百家号页面，跳过评论爬取,,0
“湘超”联赛将于9月启幕 大中学生球员占比近六成,9月1日 20:42,0,,,非百家号页面，跳过评论爬取,,0
湖南省足球联赛揭幕战门票今日开售 岳阳主场首战时间确定,,1,金马侬的魔法师Zoe,09-01 18:43,岳阳主场首秀来了，9块9看球真香，赶紧抢票别错过。,江西,1
