子事件,子事件时间,评论序号,用户ID,评论时间,评论内容,用户位置,评论点赞量
"护士哭诉调休难后续,多同事曝猛料,卫健委回应,丈夫称4天连休",9月3日 13:12,0,,,非百家号页面，跳过评论爬取,,0
"“最快女护士”马拉松夺冠后哭求调休,同行:同事、科室的牺牲应该被看见",9月2日 19:15,0,,,非百家号页面，跳过评论爬取,,0
"“最快女护士”马拉松夺冠后哭求领导调休遭网暴,所属MCN回应",9月2日 16:22,1,318314wy,09-08 23:40,院方是支持的，但是工作是同事牺牲自己利益成全的，而且不是一次两次而是长期，试问谁愿意？医护本来就幸苦，凭啥为你白白付出，人家也有家有业。,江苏,0
"“最快女护士”马拉松夺冠后哭求领导调休遭网暴,所属MCN回应",9月2日 16:22,2,hurryuphdf,09-06 14:25,调休比请假好多了！不过很多工作岗位会让人容易崩溃，比如教师和医护人员，这种有自己业余爱好的人，工作状态应该不差。 无论什么单位还是要关心一下员工，积极健康的爱好，支持一下也无妨。单位能出个马拉松冠军，不管是什么级别的也算是好事情。很多高校都会招一些体育特长生，目的就是要让他们带动学校的体育氛围，让校园生活多元化。,北京,0
"“最快女护士”马拉松夺冠后哭求领导调休遭网暴,所属MCN回应",9月2日 16:22,3,金陵夏日,09-03 09:16,凭什么要求调班，也不是专业运动员，业余的是你自己爱好，批假，调班影响其它人员，对集体人员有很大的影响。,江苏,5
"“最快女护士”马拉松夺冠后哭求领导调休遭网暴,所属MCN回应",9月2日 16:22,4,318314wy,09-08 23:38,建立在别人痛苦之上的荣誉没啥光荣的，自私自利,江苏,0
护士全马夺冠后续，三个月参赛十次，喊话调休惹争议,9月2日 10:39,0,,,非百家号页面，跳过评论爬取,,0
哈尔滨马拉松张水华哭求调休参赛,9月1日 21:39,0,,,非百家号页面，跳过评论爬取,,0
