子事件,子事件时间,评论序号,用户ID,评论时间,评论内容,用户位置,评论点赞量
特朗普威胁对俄制裁 普京警告26国:敢向乌派兵就打!,9月8日 22:06,0,,,非百家号页面，跳过评论爬取,,0
"26国将派兵基辅?普京迎来外援,局势变成26对2",9月7日 09:07,0,,,非百家号页面，跳过评论爬取,,0
普京说敢部署就敢打!马克龙称26国出兵乌克兰,9月7日 08:10,0,,,非百家号页面，跳过评论爬取,,0
欧洲26国随时出兵，普京放狠话，来一个打一个,9月6日 15:54,0,,,非百家号页面，跳过评论爬取,,0
"普京愤怒26国扬言驻军乌克兰,特朗普彻底失败?",9月6日 14:44,0,,,非百家号页面，跳过评论爬取,,0
普京:北约军队如在乌出现 将成俄军合法打击目标,9月6日 09:34,0,,,非百家号页面，跳过评论爬取,,0
俄罗斯总统普京称外国军队如在乌出现将成俄军合法打击目标,9月6日 06:57,0,,,非百家号页面，跳过评论爬取,,0
"普京备好了鸿门宴,放话谈不成就打,26国派兵入乌,局势一触即发",9月5日 17:00,0,,,非百家号页面，跳过评论爬取,,0
