子事件,子事件时间,评论序号,用户ID,评论时间,评论内容,用户位置,评论点赞量
公募改革每年将让利超500亿元,9月8日 15:28,0,,,非百家号页面，跳过评论爬取,,0
引导长期投资 公募基金销售费率拟调降,9月8日 00:02,0,,,非百家号页面，跳过评论爬取,,0
公募基金降费改革收官在即 每年让利有望超500亿元,9月6日 08:06,0,,,非百家号页面，跳过评论爬取,,0
公募销售费率改革重磅文件发布,9月5日 21:59,1,多情少年笑开颜,09-06 06:21,作者用心了，点个赞👍,上海,0
公募销售费用管理新规:公募基金赎回费部分归基金资产所有,9月5日 20:09,1,lint爱吃雪糕,09-06 08:26,新规让赎回费归基金资产，销售渠道佣金缩水，肯定不爽。渠道依赖这吃饭，冲突难免，就像券商和银行间常为费用扯皮一样。,宁夏,0
公募销售费用新规出台，鼓励长期投资降低短期炒作成本,,1,勇猛消防员长风,09-06 08:31,简单却不失深意💡,天津,0
公募销售费用新规出台，鼓励长期投资降低短期炒作成本,,2,嬴量CB,09-06 09:45,基金经理拿着基民的血汗钱去高位接盘股票，基金经理自己赚得盆满钵满，每年基民还要交管理费，这样的市场适合投资？？？2022年大盘3200点买的基金，到现在大盘3800点我的基金还亏百分之42，这样的市场适合投资吗？最高亏百分之70多，这是比诈骗可怕吧？？别说基民赚钱，请问几位基民不亏钱？？完全是收割基民，为什么现在买基金的人越来越少，因为被诈骗拍了，基金经理拿着基民的血汗钱乱投资自己不承担任何风险，而且还赚钱，我会让我的子子孙孙记住不要买基金，股票！血的教训！,重庆,0
